smartctl version 5.38 [i686-pc-linux-gnu] Copyright (C) 2002-8 Bruce Allen
Home page is http://smartmontools.sourceforge.net/

=== START OF INFORMATION SECTION ===
Model Family:     Western Digital Caviar family
Device Model:     WDC WD800BB-00CAA0
Serial Number:    WD-WMA8E8578488
Firmware Version: 16.06V16
User Capacity:    80,026,361,856 bytes
Device is:        In smartctl database [for details use: -P show]
ATA Version is:   5
ATA Standard is:  Exact ATA specification draft version not indicated
Local Time is:    Wed Apr  8 19:45:45 2009 EDT
SMART support is: Available - device has SMART capability.
SMART support is: Enabled

=== START OF READ SMART DATA SECTION ===
SMART overall-health self-assessment test result: PASSED

General SMART Values:
Offline data collection status:  (0x85)	Offline data collection activity
					was aborted by an interrupting command from host.
					Auto Offline Data Collection: Enabled.
Self-test execution status:      (   0)	The previous self-test routine completed
					without error or no self-test has ever 
					been run.
Total time to complete Offline 
data collection: 		 (3120) seconds.
Offline data collection
capabilities: 			 (0x3b) SMART execute Offline immediate.
					Auto Offline data collection on/off support.
					Suspend Offline collection upon new
					command.
					Offline surface scan supported.
					Self-test supported.
					Conveyance Self-test supported.
					No Selective Self-test supported.
SMART capabilities:            (0x0003)	Saves SMART data before entering
					power-saving mode.
					Supports SMART auto save timer.
Error logging capability:        (0x01)	Error logging supported.
					No General Purpose Logging support.
Short self-test routine 
recommended polling time: 	 (   2) minutes.
Extended self-test routine
recommended polling time: 	 (  58) minutes.
Conveyance self-test routine
recommended polling time: 	 (   5) minutes.

SMART Attributes Data Structure revision number: 16
Vendor Specific SMART Attributes with Thresholds:
ID# ATTRIBUTE_NAME          FLAG     VALUE WORST THRESH TYPE      UPDATED  WHEN_FAILED RAW_VALUE
  1 Raw_Read_Error_Rate     0x000b   200   200   051    Pre-fail  Always       -       0
  3 Spin_Up_Time            0x0007   108   094   021    Pre-fail  Always       -       3691
  4 Start_Stop_Count        0x0032   098   098   040    Old_age   Always       -       2332
  5 Reallocated_Sector_Ct   0x0033   200   200   140    Pre-fail  Always       -       0
  7 Seek_Error_Rate         0x000b   100   253   051    Pre-fail  Always       -       0
  9 Power_On_Hours          0x0032   078   078   000    Old_age   Always       -       16373
 10 Spin_Retry_Count        0x0013   099   097   051    Pre-fail  Always       -       3
 11 Calibration_Retry_Count 0x0013   100   100   051    Pre-fail  Always       -       0
 12 Power_Cycle_Count       0x0032   099   099   000    Old_age   Always       -       1423
196 Reallocated_Event_Count 0x0032   200   200   000    Old_age   Always       -       0
197 Current_Pending_Sector  0x0012   200   200   000    Old_age   Always       -       0
198 Offline_Uncorrectable   0x0012   200   200   000    Old_age   Always       -       0
199 UDMA_CRC_Error_Count    0x000a   200   253   000    Old_age   Always       -       0
200 Multi_Zone_Error_Rate   0x0009   200   200   051    Pre-fail  Offline      -       0

SMART Error Log Version: 1
No Errors Logged

SMART Self-test log structure revision number 1
Num  Test_Description    Status                  Remaining  LifeTime(hours)  LBA_of_first_error
# 1  Extended offline    Completed without error       00%      1081         -

Device does not support Selective Self Tests/Logging
